{
  "name": "Gratis",
  "price": 0,
  "priceLabel": "$0 / mes",
  "description": "Ideal para empezar y validar tu presencia digital.",
  "features": ["1 foto básica", "Datos esenciales y horarios", "Visibilidad estándar"],
  "limitations": ["Sin botón directo a WhatsApp", "Posición inferior en búsquedas"],
  "cta": "Empezar gratis",
  "highlighted": false
}
