{
  "name": "Bronce",
  "price": 5000,
  "priceLabel": "$5.000 / mes",
  "description": "Para oficios e independientes que necesitan llamadas directas.",
  "features": [
    "Hasta 3 fotos",
    "Botón directo a WhatsApp",
    "Logo y horarios comercializables",
    "Posición prioritaria sobre Gratis"
  ],
  "cta": "Elegir Bronce",
  "highlighted": false,
  "badge": "Emprendedor"
}
